{
  "$schema": "https://json-schema.org/draft/2020-12/schema",
  "$id": "./diagram.schema.json",
  "type": "object",
  "properties": {
    "id": {
      "type": "string",
      "pattern": "^[a-z0-9][a-z0-9-]*$"
    },
    "title": {
      "type": "string",
      "minLength": 1
    },
    "generatorId": {
      "type": "string",
      "pattern": "^[a-z0-9]+(?:-[a-z0-9]+)*$"
    },
    "generatorInstructions": {
      "type": "string",
      "minLength": 1
    },
    "layout": {
      "oneOf": [
        {
          "type": "object",
          "properties": {
            "id": {
              "type": "string",
              "const": "elk-layered"
            },
            "options": {
              "type": "object",
              "properties": {
                "direction": {
                  "type": "string",
                  "enum": [
                    "UP",
                    "DOWN",
                    "LEFT",
                    "RIGHT"
                  ]
                }
              },
              "additionalProperties": false
            }
          },
          "required": [
            "id"
          ],
          "additionalProperties": false
        },
        {
          "type": "object",
          "properties": {
            "id": {
              "type": "string",
              "const": "sequence"
            }
          },
          "required": [
            "id"
          ],
          "additionalProperties": false
        }
      ]
    },
    "links": {
      "readOnly": true,
      "type": "array",
      "items": {
        "type": "object",
        "properties": {
          "text": {
            "type": "string",
            "minLength": 1
          },
          "href": {
            "type": "string",
            "minLength": 1
          }
        },
        "required": [
          "href"
        ],
        "additionalProperties": false
      }
    },
    "graph": {
      "$ref": "./diagram-graph.schema.json"
    }
  },
  "required": [
    "id",
    "title",
    "generatorId",
    "layout",
    "graph"
  ],
  "additionalProperties": false
}
